M_2.3.3.1,2.,2.3,2.3.3 ระบุ Intelligent Risk ที่อาจส่งผลต่อบรรลุเป้าหมายในแต่ละตำแหน่งเชิงยุทธศาสตร์ขององค์กร,วิเคราะห์ Intelligent Risk หรือ วิเคราะห์ความเสี่ยงเพื่อเข้าถึงโอกาสทางธุรกิจ โดยมีการกำหนด Business Model และระบุ Intelligent Risk ที่อาจส่งผลต่อบรรลุเป้าหมายในแต่ละตำแหน่งเชิงยุทธศาสตร์ขององค์กร,งานบริหารความเสี่ยง / เป็ด
M_2.3.3.2,2.,2.3,2.3.3 ระบุ Intelligent Risk ที่อาจส่งผลต่อบรรลุเป้าหมายในแต่ละตำแหน่งเชิงยุทธศาสตร์ขององค์กร,"จัดทำข้อมูล Emerging Risk, Intelligent Risk ประกอบเล่มแผนวิสาหกิจการไฟฟ้านครหลวง โดยอาจจัดทำภาคผนวก บทวิเคราะห์ความเสี่ยง แสดงความเชื่อมโยงการบริหารความเสี่ยง (Risk Appetite Intelligent Risk ปัจจัยเสี่ยง SO ความเสี่ยงของเแผนปฏิบัติเชิงยุทธศาสตร์) และการจัดทำแผนยุทธศาสตร์",งานบริหารความเสี่ยง / เป็ด
M_2.3.4.1,2.,2.3,2.3.4 ระบุและวิเคราะห์ความเสี่ยงที่อาจส่งผลต่อการบรรลุวัตถุประสงค์เชิงยุทธศาสตร์ (SO),ระบุและวิเคราะห์ความเสี่ยงที่อาจส่งผลต่อการบรรลุวัตถุประสงค์เชิงยุทธศาสตร์ (SO),งานบริหารความเสี่ยง / เป็ด
M_2.3.4.2,2.,2.3,2.3.4 ระบุและวิเคราะห์ความเสี่ยงที่อาจส่งผลต่อการบรรลุวัตถุประสงค์เชิงยุทธศาสตร์ (SO),นำข้อมูลความเสี่ยงเข้า Risk Inventory,งานบริหารความเสี่ยง / เป็ด
M_2.3.5.1,2.,2.3,2.3.5 ทบทวนแบบฟอร์มและเกณฑ์การประเมินความเสี่ยงและ ประสิทธิผลของการควบคุมของแผน AP และแผนแม่บทที่เกี่ยวข้อง,ทบทวนแบบฟอร์มและเกณฑ์การประเมินความเสี่ยง AP และ ประสิทธิผลของการควบคุม และแผนแม่บทที่เกี่ยวข้อง,งานบริหารความเสี่ยง / เป็ด
M_2.3.6.1,2.,2.3,2.3.6 สื่อสารแบบฟอร์มการประเมินความเสี่ยง และหลักเกณฑ์การประเมินความเพียงพอของการควบคุมภายใน,สื่อสารแบบฟอร์มการประเมินความเสี่ยง และหลักเกณฑ์การประเมินความเพียงพอของการควบคุมภายใน,งานบริหารความเสี่ยง / เป็ด
M_2.3.6.2,2.,2.3,2.3.6 สื่อสารแบบฟอร์มการประเมินความเสี่ยง และหลักเกณฑ์การประเมินความเพียงพอของการควบคุมภายใน,หน่วยงานเจ้าของแผนฯ วิเคราะห์ ระบุ และประเมินความเสี่ยงของแผนปฏิบัติการ พร้อมกำหนดมาตรการจัดการความเสี่ยง ในกรณีที่ความเสี่ยงอยู่ในระดับที่ไม่สามารถยอมรับได้,งานบริหารความเสี่ยง / เป็ด
M_2.3.6.3,2.,2.3,2.3.6 สื่อสารแบบฟอร์มการประเมินความเสี่ยง และหลักเกณฑ์การประเมินความเพียงพอของการควบคุมภายใน,พิจารณาความเสี่ยงที่สำคัญเป็นปัจจัยนำเข้าในกระบวนการบริหารความเสี่ยงองค์กร,งานบริหารความเสี่ยง / เป็ด
M_2.3.7.1,2.,2.3,2.3.7 ติดตามการวิเคราะห์ ระบุ และประเมินความเสี่ยงของแผนปฏิบัติการ และแผนแม่บทที่เกี่ยวข้อง พร้อมกำหนดมาตรการจัดการความเสี่ยง,ประสานงานกับ AP Owner ในการทบทวนการประเมินความเสี่ยง,งานบริหารความเสี่ยง / เป็ด
M_2.3.7.2,2.,2.3,2.3.7 ติดตามการวิเคราะห์ ระบุ และประเมินความเสี่ยงของแผนปฏิบัติการ และแผนแม่บทที่เกี่ยวข้อง พร้อมกำหนดมาตรการจัดการความเสี่ยง,ติดตามข้อมูลผลการประเมินฯ และให้ข้อเสนอแนะในการกำหนดมาตรการจัดการความเสี่ยง (ถ้ามี),งานบริหารความเสี่ยง / เป็ด
M_2.3.7.3,2.,2.3,2.3.7 ติดตามการวิเคราะห์ ระบุ และประเมินความเสี่ยงของแผนปฏิบัติการ และแผนแม่บทที่เกี่ยวข้อง พร้อมกำหนดมาตรการจัดการความเสี่ยง,ประเมินประสิทธิผลของการวิเคราะห์ความเสี่ยงของ AP และนำข้อมูลไปใช้เพื่อปรับปรุงกระบวนการฯ,งานบริหารความเสี่ยง / เป็ด
M_2.4.1.1,2.,2.4,2.4.1 รวบรวม/วิเคราะห์ข้อมูลความเสี่ยง การควบคุม และนำเข้าใน Risk Inventory พร้อมทบทวนเกณฑ์ประเมินการควบคุม,ติดตามสถานการณ์ภายในและภายนอก เพื่อระบุความเสี่ยง,งานบริหารความเสี่ยง
M_2.4.1.2,2.,2.4,2.4.1 รวบรวม/วิเคราะห์ข้อมูลความเสี่ยง การควบคุม และนำเข้าใน Risk Inventory พร้อมทบทวนเกณฑ์ประเมินการควบคุม,นำข้อมูลความเสี่ยงเข้า Risk Inventory,งานบริหารความเสี่ยง
M_2.4.1.3,2.,2.4,2.4.1 รวบรวม/วิเคราะห์ข้อมูลความเสี่ยง การควบคุม และนำเข้าใน Risk Inventory พร้อมทบทวนเกณฑ์ประเมินการควบคุม,ทบทวนเกณฑ์การประเมินความเสี่ยงและการควบคุม,งานบริหารความเสี่ยง
M_2.4.2.1,2.,2.4,2.4.2 คัดเลือกปัจจัยเสี่ยงระดับองค์กร พร้อมวิเคราะห์ Leading / Lagging Indicator ของแต่ละความเสี่ยง,จัดทำข้อมูลการวิเคราะห์ความเสี่ยงระดับองค์กร,งานบริหารความเสี่ยง
M_2.4.2.2,2.,2.4,2.4.2 คัดเลือกปัจจัยเสี่ยงระดับองค์กร พร้อมวิเคราะห์ Leading / Lagging Indicator ของแต่ละความเสี่ยง,วิเคราะห์ Leading / Lagging Indicator ของแต่ละความเสี่ยง,งานบริหารความเสี่ยง
M_2.4.3.1,2.,2.4,2.4.3 จัดให้มีการประเมินความเสี่ยง และสื่อสารความเสี่ยงต่อผู้รับผิดชอบ,จัดให้มีการประเมินความเสี่ยง,งานบริหารความเสี่ยง
M_2.4.3.2,2.,2.4,2.4.3 จัดให้มีการประเมินความเสี่ยง และสื่อสารความเสี่ยงต่อผู้รับผิดชอบ,สื่อสารความเสี่ยงต่อผู้รับผิดชอบ,งานบริหารความเสี่ยง
M_2.4.4.1,2.,2.4,2.4.4 พิจารณาและคัดเลือกวิธีการจัดการความเสี่ยง พร้อมทั้ง วิเคราะห์และจัดทำ Risk Correlation Map/Portfolio View of Risk,พิจารณาและคัดเลือกวิธีการจัดการความเสี่ยง,งานบริหารความเสี่ยง
M_2.4.4.2,2.,2.4,2.4.4 พิจารณาและคัดเลือกวิธีการจัดการความเสี่ยง พร้อมทั้ง วิเคราะห์และจัดทำ Risk Correlation Map/Portfolio View of Risk,วิเคราะห์และจัดทำ Risk Correlation Map/Portfolio View of Risk,งานบริหารความเสี่ยง
M_2.4.5.1,2.,2.4,2.4.5 จัดทำแผนบริหารความเสี่ยง และทบทวนแผนบริหารความเสี่ยงของปีถัดไป,ประสานงานกับ Risk Owner เพื่อจัดทำแผนบริหารความเสี่ยงองค์กร และนำเสนอขอความเห็นชอบ,งานบริหารความเสี่ยง
M_2.4.6.1,2.,2.4,2.4.6 ติดตามและรายงานผลการบริหารความเสี่ยงและการควบคุมของความเสี่ยงปีปัจจุบัน,ติดตามและรายงานผลการบริหารความเสี่ยงและการควบคุมของความเสี่ยงปีปัจจุบัน,งานบริหารความเสี่ยง
M_2.4.6.2,2.,2.4,2.4.6 ติดตามและรายงานผลการบริหารความเสี่ยงและการควบคุมของความเสี่ยงปีปัจจุบัน,นำเข้าข้อมูลเข้า Dashboard,งานบริหารความเสี่ยง
M_2.4.6.3,2.,2.4,2.4.6 ติดตามและรายงานผลการบริหารความเสี่ยงและการควบคุมของความเสี่ยงปีปัจจุบัน,จัดทำวิเคราะห์ผลการดำเนินงานการบริหารความเสี่ยง รายไตรมาส และรายปี,งานบริหารความเสี่ยง
M_2.4.7.1,2.,2.4,2.4.7 พัฒนาระบบเทคโนโลยีดิจิทัลเพื่อสนับสนุนกระบวนการบริหารความเสี่ยง และระบบเตือนภัยล่วงหน้า,ร่วมกับ ฝผก. กำหนดขั้นตอนและจัดทำระบบในการแจ้งเตือนภัยล่วงหน้าสำหรับแผน AP นำร่อง,งานบริหารความเสี่ยง
M_2.4.8.1,2.,2.4,2.4.8 ทบทวน ประเมินประสิทธิผล และปรับปรุงกระบวนการบริหารความเสี่ยง,ทบทวนผลการดำเนินงานของแผนบริหารความเสี่ยง,งานบริหารความเสี่ยง
M_2.4.8.2,2.,2.4,2.4.8 ทบทวน ประเมินประสิทธิผล และปรับปรุงกระบวนการบริหารความเสี่ยง,ทบทวนผลการดำเนินงานตามกระบวนการบริหารความเสี่ยง,งานบริหารความเสี่ยง
M_2.4.8.3,2.,2.4,2.4.8 ทบทวน ประเมินประสิทธิผล และปรับปรุงกระบวนการบริหารความเสี่ยง,บูรณาการการปรับปรุงกระบวนบริหารความเสี่ยงกับกระบวนการอื่นที่เกี่ยวข้อง,งานบริหารความเสี่ยง
M_2.4.8.4,2.,2.4,2.4.8 ทบทวน ประเมินประสิทธิผล และปรับปรุงกระบวนการบริหารความเสี่ยง,กำหนดแนวทางการปรับปรุง และจัดทำแผนฯ ในปีถัดไป,งานบริหารความเสี่ยง
M_2.5.1.1,2.,2.5,2.5.1 วิเคราะห์ผลกระทบทางธุรกิจ ประเมินความเสี่ยง ทบทวนกลยุทธ์ และ BCP,ทบทวนแบบฟอร์มและขั้นตอนการวิเคราะห์ผลกระทบทางธุรกิจและประเมินความเสี่ยง,งานบริหารความเสี่ยง
M_2.5.1.2,2.,2.5,2.5.1 วิเคราะห์ผลกระทบทางธุรกิจ ประเมินความเสี่ยง ทบทวนกลยุทธ์ และ BCP,จัดการประชุมเชิงปฏิบัติการร่วมกับหน่วยงานเพื่อวิเคราะห์และประเมินฯ และทบทวนกลยุทธ์,งานบริหารความเสี่ยง
M_2.5.1.3,2.,2.5,2.5.1 วิเคราะห์ผลกระทบทางธุรกิจ ประเมินความเสี่ยง ทบทวนกลยุทธ์ และ BCP,รวบรวมข้อมูลผลการวิเคราะห์/ประเมิน นำเสนอผู้บริหาร,งานบริหารความเสี่ยง
M_2.5.1.4,2.,2.5,2.5.1 วิเคราะห์ผลกระทบทางธุรกิจ ประเมินความเสี่ยง ทบทวนกลยุทธ์ และ BCP,ประสานงานหน่วยงานในการทบทวน/จัดทำ BCP,งานบริหารความเสี่ยง
M_2.5.1.5,2.,2.5,2.5.1 วิเคราะห์ผลกระทบทางธุรกิจ ประเมินความเสี่ยง ทบทวนกลยุทธ์ และ BCP,รวบรวม BCP นำเสนอคณะผู้บริหาร/คณะกรรมการที่เกี่ยวข้อง,งานบริหารความเสี่ยง
M_2.5.2.1,2.,2.5,2.5.2 ติดตามและเข้าร่วมฝึกซ้อม BCP ของหน่วยงาน,แจ้งหน่วยงานกำหนดแผนการฝึกซ้อมประจำปี,งานบริหารความเสี่ยง
M_2.5.2.2,2.,2.5,2.5.2 ติดตามและเข้าร่วมฝึกซ้อม BCP ของหน่วยงาน,รวบรวบแผนการฝึกซ้อมและวิเคราะห์ความจำเป็นในการเข้าร่วมสังเกตการณ์การฝึกซ้อม,งานบริหารความเสี่ยง
M_2.5.2.3,2.,2.5,2.5.2 ติดตามและเข้าร่วมฝึกซ้อม BCP ของหน่วยงาน,เข้าร่วมสังเกตการณ์การฝึกซ้อมตามที่กำหนด,งานบริหารความเสี่ยง
M_2.5.2.4,2.,2.5,2.5.2 ติดตามและเข้าร่วมฝึกซ้อม BCP ของหน่วยงาน,สรุปผลการสังเกตการณ์ฝึกซ้อมและรายงานแก่ผู้ที่เกี่ยวข้อง,งานบริหารความเสี่ยง
M_2.5.3.1,2.,2.5,2.5.3 ฝึกซ้อมสถานการณ์ใหญ่,รวบรวมและวิเคราะห์ข้อมูลเพื่อกำหนดสถานการณ์ในการฝึกซ้อม,งานบริหารความเสี่ยง
M_2.5.3.2,2.,2.5,2.5.3 ฝึกซ้อมสถานการณ์ใหญ่,จัดทำแผนการฝึกซ้อมสถานการณ์ใหญ่นำเสนอผู้ที่เกี่ยวข้อง,งานบริหารความเสี่ยง
M_2.5.3.3,2.,2.5,2.5.3 ฝึกซ้อมสถานการณ์ใหญ่,ประชุม/ประสานงานกับหน่วยงานที่เกี่ยวข้องเพื่อเตรียมการฝึกซ้อม,งานบริหารความเสี่ยง
M_2.5.3.4,2.,2.5,2.5.3 ฝึกซ้อมสถานการณ์ใหญ่,จัดการฝึกซ้อมสถานการณ์ใหญ่ประจำปี,งานบริหารความเสี่ยง
M_2.5.3.5,2.,2.5,2.5.3 ฝึกซ้อมสถานการณ์ใหญ่,จัดทำสรุปผลการฝึกซ้อม และแนวทางการปรับปรุงการดำเนินงาน,งานบริหารความเสี่ยง
M_2.5.4.1,2.,2.5,2.5.4 สร้างความตระหนักและสื่อสารข้อมูลเกี่ยวกับการบริหารความต่อเนื่องทางธุรกิจ,รวบรวมข้อมูลบทเรียนจากสถานการณ์จริง/การอบรมต่าง ๆ,งานบริหารความเสี่ยง
M_2.5.4.2,2.,2.5,2.5.4 สร้างความตระหนักและสื่อสารข้อมูลเกี่ยวกับการบริหารความต่อเนื่องทางธุรกิจ,จัดทำบทวิเคราะห์/ข้อมูลเผยแพร่แก่กลุ่มเป้าหมาย,งานบริหารความเสี่ยง
M_2.5.4.3,2.,2.5,2.5.4 สร้างความตระหนักและสื่อสารข้อมูลเกี่ยวกับการบริหารความต่อเนื่องทางธุรกิจ,ดำเนินการสื่อสารตามช่องทางที่กำหนด,งานบริหารความเสี่ยง
M_2.5.4.4,2.,2.5,2.5.4 สร้างความตระหนักและสื่อสารข้อมูลเกี่ยวกับการบริหารความต่อเนื่องทางธุรกิจ,ประเมินผลการสร้างความตระหนักและสื่อสาร,งานบริหารความเสี่ยง
M_2.5.5.1,2.,2.5,2.5.5 ตรวจประเมินภายใน/ภายนอก พร้อมทบทวนและปรับปรุงการบริหารความต่อเนื่องทางธุรกิจและความพร้อมใช้ของระบบ,ประสานงานผู้ตรวจประเมินภายใน/ที่ปรึกษาในการจัดทำ Audit Plan,งานบริหารความเสี่ยง
M_2.5.5.2,2.,2.5,2.5.5 ตรวจประเมินภายใน/ภายนอก พร้อมทบทวนและปรับปรุงการบริหารความต่อเนื่องทางธุรกิจและความพร้อมใช้ของระบบ,ดำเนินการตรวจประเมินภายในตามแผนที่กำหนด,งานบริหารความเสี่ยง
M_2.5.5.3,2.,2.5,2.5.5 ตรวจประเมินภายใน/ภายนอก พร้อมทบทวนและปรับปรุงการบริหารความต่อเนื่องทางธุรกิจและความพร้อมใช้ของระบบ,จัดทำสรุปผลการตรวจประเมิน และแจ้งผลแก่หน่วยงานที่เกี่ยวข้อง,งานบริหารความเสี่ยง
M_2.5.5.4,2.,2.5,2.5.5 ตรวจประเมินภายใน/ภายนอก พร้อมทบทวนและปรับปรุงการบริหารความต่อเนื่องทางธุรกิจและความพร้อมใช้ของระบบ,ติดตามผลการปรับปรุง/แก้ไขตามผลการตรวจประเมิน,งานบริหารความเสี่ยง
M_2.5.5.5,2.,2.5,2.5.5 ตรวจประเมินภายใน/ภายนอก พร้อมทบทวนและปรับปรุงการบริหารความต่อเนื่องทางธุรกิจและความพร้อมใช้ของระบบ,ประสานงานกับ CB ในการตรวจประเมินเพื่อขอการรับรอง,งานบริหารความเสี่ยง
M_2.5.5.6,2.,2.5,2.5.5 ตรวจประเมินภายใน/ภายนอก พร้อมทบทวนและปรับปรุงการบริหารความต่อเนื่องทางธุรกิจและความพร้อมใช้ของระบบ,ประสานงานกับหน่วยรับตรวจ เพื่อเตรียมการตรวจประเมิน,งานบริหารความเสี่ยง
M_2.5.5.7,2.,2.5,2.5.5 ตรวจประเมินภายใน/ภายนอก พร้อมทบทวนและปรับปรุงการบริหารความต่อเนื่องทางธุรกิจและความพร้อมใช้ของระบบ,ดำเนินการตรวจประเมินตามที่กำหนด,งานบริหารความเสี่ยง
