M_2.5.5.8,2.,2.5,2.5.5 ตรวจประเมินภายใน/ภายนอก พร้อมทบทวนและปรับปรุงการบริหารความต่อเนื่องทางธุรกิจและความพร้อมใช้ของระบบ,แจ้งผลการตรวจประเมินแก่หน่วยงานที่เกี่ยวข้อง,งานบริหารความเสี่ยง
M_2.5.5.9,2.,2.5,2.5.5 ตรวจประเมินภายใน/ภายนอก พร้อมทบทวนและปรับปรุงการบริหารความต่อเนื่องทางธุรกิจและความพร้อมใช้ของระบบ,ทบทวนผลการดำเนินงาน และกำหนดแนวทางการปรับปรุงในปีถัดไป,งานบริหารความเสี่ยง
P_3.1,3.,3.1,3.1 ปรับปรุงฐานข้อมูลที่ใช้ในการวิเคราะห์และติดตามการดำเนินงานแบบบูรณาการในกระบวนการทำงานที่สำคัญ,ปรับปรุงฐานข้อมูลที่ใช้ในการวิเคราะห์และติดตามการดำเนินงานแบบบูรณาการในกระบวนการทำงานที่สำคัญ (ทั้งกิจกรรม),
P_3.2,3.,3.2,3.2 ใช้งานระบบ GRC เพื่อสนับสนุนการทำงานให้ลดความซับซ้อน ลดระยะเวลา และมีความถูกต้องแม่นยำ,ใช้งานระบบ GRC เพื่อสนับสนุนการทำงานให้ลดความซับซ้อน ลดระยะเวลา และมีความถูกต้องแม่นยำ (ทั้งกิจกรรม),
P_3.3,3.,3.3,3.3 ทบทวนการทำ Value Creation และ Value Enhancement ที่เชื่อมโยงกับกระบวนการกำหนดตำแหน่งเชิงยุทธศาสตร์ วัตถุประสงค์เชิงยุทธศาสตร์ แผนยุทธศาสตร์องค์กร และแผนแม่บทอื่นๆ ที่เกี่ยวข้องอย่างต่อเนื่อง,ทบทวนการทำ Value Creation และ Value Enhancement ที่เชื่อมโยงกับกระบวนการกำหนดตำแหน่งเชิงยุทธศาสตร์ วัตถุประสงค์เชิงยุทธศาสตร์ แผนยุทธศาสตร์องค์กร และแผนแม่บทอื่นๆ ที่เกี่ยวข้องอย่างต่อเนื่อง (ทั้งกิจกรรม),
P_3.4,3.,3.4,3.4 กำหนดกระบวนการในการวิเคราะห์ถึงภาพรวมของความเสี่ยง (Portfolio View of Risk),กำหนดกระบวนการในการวิเคราะห์ถึงภาพรวมของความเสี่ยง (Portfolio View of Risk) (ทั้งกิจกรรม),
P_3.5,3.,3.5,3.5 พัฒนา Portfolio View of Risk แสดงการจัดทำแบบจำลองที่เหมาะสม/นำแบบจำลองดังกล่าวไปใช้ในการบริหารความเสี่ยงในภาพรวม,พัฒนา Portfolio View of Risk แสดงการจัดทำแบบจำลองที่เหมาะสม/นำแบบจำลองดังกล่าวไปใช้ในการบริหารความเสี่ยงในภาพรวม (ทั้งกิจกรรม),
