รหัสกิจกรรม,แผนหลัก,แผนงานย่อย,กิจกรรมหลัก,ชื่อกิจกรรมย่อย,ผู้รับผิดชอบ
P_1.1.1,1.,1.1,1.1 การปรับปรุงโครงสร้างการดำเนินงานด้าน GRC เพื่อการดำเนินงานระดับสายงาน,ออกแบบและปรับโครงสร้างคณะทำงาน GRC,
P_1.2.1,1.,1.2,1.2 โครงสร้างหน่วยงานที่ทำหน้าที่รับผิดชอบการกำกับดูแลด้าน IT Risk และ IT Compliance (รวมถึงระบบเทคโนโลยีดิจิทัล และ AI) (2nd line),วางแผนและปรับโครงสร้าง บทบาท หน้าที่,
P_1.3.1,1.,1.3,1.3 การจัดทำ Risk Taxonomy เพื่อความสอดคล้องในการระบุ และจัดประเภทความเสี่ยง,ออกแบบและพัฒนา Risk Taxonomy,
P_1.4.1,1.,1.4,1.4 การวิเคราะห์ตัวชี้วัดความเสี่ยง (KRI) เพื่อวิเคราะห์แนวโน้ม และคาดการณ์เหตุการณ์ความเสี่ยง,เก็บข้อมูลและวิเคราะห์แนวโน้ม KRI,
P_1.5.1,1.,1.5,1.5 การสร้างวัฒนธรรม GRC ผ่าน GRC Survey และการสนทนากลุ่ม (Focus Group),กำหนดเป้าหมายและปรับปรุง GRC survey,
P_1.5.2,1.,1.5,1.5 การสร้างวัฒนธรรม GRC ผ่าน GRC Survey และการสนทนากลุ่ม (Focus Group),เก็บผล GRC Survey นำร่องจัดทำ Focus group และการวิเคราะห์ผล,
P_1.6.1,1.,1.6,1.6 การพัฒนากระบวนการจัดทำหลักสูตรอบรมโดยอ้างอิงความเสี่ยง (Risk-based training) และติดตามผลการอบรม,วิเคราะห์และออกแบบหลักสูตรอบรม,
P_1.7.1,1.,1.7,1.7 การเชื่อมโยงการปฏิบัติงานด้าน GRC กับสิ่งจูงใจ (Incentive) หรือผลการปฏิบัติงาน (Performance),รวบรวมข้อมูลและปรับปรุงเกณฑ์การประเมิน พิจารณาหารือร่วมกับ ฝทม. (กรณีผูกกับผลการปฏิบัติงาน),
P_1.8.1,1.,1.8,1.8 การปรับปรุงนโยบายการกำกับการปฏิบัติตามกฎ ระเบียบและจัดทำนโยบาย IT Third Party Risk Management,ปรับปรุงและบังคับใช้นโยบาย,
P_1.9.1,1.,1.9,1.9 การผลักดันให้มีหน่วยงานกลางกำกับและรวบรวมนโยบาย,รวบรวมนโยบาย/แนวปฏิบัติและออกแบบกระบวนการกำกับดูแล,
P_1.10.1,1.,1.10,1.10 การบูรณาการข้อมูลกระบวนงาน,จัดทำข้อมูลกระบวนงานทั้งองค์กร,
P_1.11.1,1.,1.11,1.11 การปรับแนวทางการประเมิน CSA,ออกแบบหลักเกณฑ์และแนวทาง จัดทำ Test script จัดโครงการนำร่อง และปรับปรุงคู่มือฯ,
P_1.12.1,1.,1.12,1.12 การจัดทำแนวทาง/เอกสารในการรวบรวมข้อมูลเหตุการณ์ (Incident information),รวบรวมข้อมูลเหตุการณ์ (Incident และ Near-miss) มาวิเคราะห์แนวโน้ม,
P_1.13.1,1.,1.13,1.13 การพัฒนาเครื่องมือติดตามประสิทธิภาพการควบคุมอย่างต่อเนื่อง (Continuous Monitoring),วางแผนและขยายขอบเขต,
P_1.14.1,1.,1.14,1.14 การพัฒนาทะเบียนกฎหมาย เนื้อหาข้อบังคับที่องค์กรต้องปฏิบัติตาม (Citation) และเชื่อมโยงกับการควบคุมและนโยบาย,รวบรวมข้อมูลและจัดทำร่างทะเบียนกฎหมาย,
P_1.14.2,1.,1.14,1.14 การพัฒนาทะเบียนกฎหมาย เนื้อหาข้อบังคับที่องค์กรต้องปฏิบัติตาม (Citation) และเชื่อมโยงกับการควบคุมและนโยบาย,นำรายการกฎหมายเข้าระบบ Compliance Management System,
M_2.1.1.1,2.,2.1,2.1.1 ทบทวนนโยบาย GRC,พิจารณาผลการดำเนินการตามนโยบาย GRC ในปัจจุบัน,งานบริหารความเสี่ยง / พี่หนึ่ง
M_2.1.1.2,2.,2.1,2.1.1 ทบทวนนโยบาย GRC,ทบทวนนโยบาย GRC และปรับปรุงให้สอดคล้องกับบริบทของรัฐวิสาหกิจและมาตรฐานสากลที่เปลี่ยนแปลงไป,งานบริหารความเสี่ยง / พี่หนึ่ง
M_2.1.1.3,2.,2.1,2.1.1 ทบทวนนโยบาย GRC,นำเสนอผู้บริหาร เพื่อพิจารณาให้ความเห็นชอบ,งานบริหารความเสี่ยง / พี่หนึ่ง
M_2.1.1.4,2.,2.1,2.1.1 ทบทวนนโยบาย GRC,นำเสนอคณะอนุกรรมการฯ เพื่อพิจารณาให้ความเห็นชอบ,งานบริหารความเสี่ยง / พี่หนึ่ง
M_2.1.1.5,2.,2.1,2.1.1 ทบทวนนโยบาย GRC,นำเสนอคณะกรรมการ กฟน. เพื่อพิจารณาให้ความเห็นชอบ,งานบริหารความเสี่ยง / พี่หนึ่ง
M_2.1.2.1,2.,2.1,2.1.2 ทบทวนโครงสร้างและบทบาทหน้าที่ด้านการบริหารความเสี่ยง,ทบทวนความสอดคล้องของโครงสร้างและบทบาทหน้าที่ด้านการบริหารความเสี่ยง การควบคุมภายใน และกระบวนการอื่นที่เกี่ยวข้อง,งานบริหารความเสี่ยง / พี่หนึ่ง
M_2.1.2.2,2.,2.1,2.1.2 ทบทวนโครงสร้างและบทบาทหน้าที่ด้านการบริหารความเสี่ยง,นำเสนอผู้บริหาร เพื่อพิจารณาให้ความเห็นชอบ,งานบริหารความเสี่ยง / พี่หนึ่ง
M_2.1.2.3,2.,2.1,2.1.2 ทบทวนโครงสร้างและบทบาทหน้าที่ด้านการบริหารความเสี่ยง,นำเสนอคณะอนุกรรมการฯ เพื่อพิจารณาให้ความเห็นชอบ,งานบริหารความเสี่ยง / พี่หนึ่ง
M_2.1.2.4,2.,2.1,2.1.2 ทบทวนโครงสร้างและบทบาทหน้าที่ด้านการบริหารความเสี่ยง,นำเสนอคณะกรรมการ กฟน. เพื่อทราบ,งานบริหารความเสี่ยง / พี่หนึ่ง
M_2.1.3.1,2.,2.1,2.1.3 ทบทวนกรอบการดำเนินงานและคู่มือการบริหารความเสี่ยง,พิจารณาข้อมูลจาก Feedback Report และแบบประเมินประสิทธิผลของปีก่อน,งานบริหารความเสี่ยง / พี่หนึ่ง
M_2.1.3.2,2.,2.1,2.1.3 ทบทวนกรอบการดำเนินงานและคู่มือการบริหารความเสี่ยง,ทบทวนกรอบการดำเนินงาน กระบวนการ และคู่มือการบริหารความเสี่ยง,งานบริหารความเสี่ยง / พี่หนึ่ง
M_2.1.3.3,2.,2.1,2.1.3 ทบทวนกรอบการดำเนินงานและคู่มือการบริหารความเสี่ยง,นำเสนอผู้บริหาร เพื่อพิจารณาให้ความเห็นชอบ,งานบริหารความเสี่ยง / พี่หนึ่ง
M_2.1.3.4,2.,2.1,2.1.3 ทบทวนกรอบการดำเนินงานและคู่มือการบริหารความเสี่ยง,นำเสนอคณะอนุกรรมการฯ เพื่อพิจารณาให้ความเห็นชอบ,งานบริหารความเสี่ยง / พี่หนึ่ง
M_2.1.3.5,2.,2.1,2.1.3 ทบทวนกรอบการดำเนินงานและคู่มือการบริหารความเสี่ยง,นำเสนอคณะกรรมการ กฟน. เพื่อทราบ,งานบริหารความเสี่ยง / พี่หนึ่ง
M_2.2.1.1,2.,2.2,2.2.1 ทบทวน Competency / พฤติกรรมพึงประสงค์ด้านการบริหารความเสี่ยง กับผู้บริหาร และพนักงานที่เกี่ยวข้อง,ทบทวน Competency และแผนพัฒนาบุคลากร / Certification (พนักงาน ฝบส.),งานบริหารความเสี่ยง / แบม
M_2.2.1.2,2.,2.2,2.2.1 ทบทวน Competency / พฤติกรรมพึงประสงค์ด้านการบริหารความเสี่ยง กับผู้บริหาร และพนักงานที่เกี่ยวข้อง,ทบทวนพฤติกรรมที่พึงประสงค์ด้านการบริหารความเสี่ยงตามกลุ่มของพนักงาน,งานบริหารความเสี่ยง / แบม
M_2.2.1.3,2.,2.2,2.2.1 ทบทวน Competency / พฤติกรรมพึงประสงค์ด้านการบริหารความเสี่ยง กับผู้บริหาร และพนักงานที่เกี่ยวข้อง,ทบทวนหลักสูตร พร้อมให้ ฝอร. แจ้งการอบรม,งานบริหารความเสี่ยง / แบม
M_2.2.2.1,2.,2.2,2.2.2 อบรมและพัฒนาพนักงานตาม Competency ที่กำหนด,ส่งพนักงาน ฝบส. เข้ารับการอบรมตามแผน,งานบริหารความเสี่ยง / แบม
M_2.2.2.2,2.,2.2,2.2.2 อบรมและพัฒนาพนักงานตาม Competency ที่กำหนด,สรุปผลการอบรมพนักงาน ฝบส. และประเมิน Competency Gap,งานบริหารความเสี่ยง / แบม
M_2.2.2.3,2.,2.2,2.2.2 อบรมและพัฒนาพนักงานตาม Competency ที่กำหนด,จัดทำแผนการฝึกอบรมและพัฒนาในปีถัดไป,งานบริหารความเสี่ยง / แบม
M_2.2.2.4,2.,2.2,2.2.2 อบรมและพัฒนาพนักงานตาม Competency ที่กำหนด,ดำเนินการตามแผนการอบรม/ให้ความรู้ด้านการบริหารความเสี่ยง แก่ผู้บริหารและพนักงาน,งานบริหารความเสี่ยง / แบม
M_2.2.2.5,2.,2.2,2.2.2 อบรมและพัฒนาพนักงานตาม Competency ที่กำหนด,ประเมินประสิทธิผลการจัดการอบรม/ให้ความรู้พนักงาน,งานบริหารความเสี่ยง / แบม
M_2.2.2.6,2.,2.2,2.2.2 อบรมและพัฒนาพนักงานตาม Competency ที่กำหนด,ทบทวนและจัดทำสื่อการสอน ข้อสอบ และประสานงาน ฝอร. ในการนำเข้าระบบ e-learning,งานบริหารความเสี่ยง / แบม
M_2.2.3.1,2.,2.2,2.2.3 สื่อสารสร้างความตระหนักด้านการบริหารความเสี่ยง,ประสานงาน ฝทม. ในการสื่อสาร/ผลักดันให้เกิดพฤติกรรมที่พึงประสงค์,งานบริหารความเสี่ยง / แบม
M_2.2.3.2,2.,2.2,2.2.3 สื่อสารสร้างความตระหนักด้านการบริหารความเสี่ยง,สื่อสาร/ชี้แจงในงาน GRC Day,งานบริหารความเสี่ยง / แบม
M_2.2.3.3,2.,2.2,2.2.3 สื่อสารสร้างความตระหนักด้านการบริหารความเสี่ยง,ผู้บริหารเป็นผู้นำต้นแบบและสร้างบรรยากาศ,งานบริหารความเสี่ยง / แบม
M_2.2.3.4,2.,2.2,2.2.3 สื่อสารสร้างความตระหนักด้านการบริหารความเสี่ยง,พัฒนาพฤติกรรม ตามพฤติกรรมพึงประสงค์ด้านการบริหารความเสี่ยง กับผู้บริหาร และพนักงานที่เกี่ยวข้อง ผ่านการสื่อสารในช่องทางที่กำหนด,งานบริหารความเสี่ยง / แบม
M_2.2.4.1,2.,2.2,2.2.4 สำรวจความตระหนักและทัศนคติเกี่ยวกับการบริหารความเสี่ยง,ทบทวนข้อคำถามและจัดทำแบบสอบถาม,งานบริหารความเสี่ยง / แบม
M_2.2.4.2,2.,2.2,2.2.4 สำรวจความตระหนักและทัศนคติเกี่ยวกับการบริหารความเสี่ยง,สำรวจความตระหนักและทัศนคติเกี่ยวกับการบริหารความเสี่ยง,งานบริหารความเสี่ยง / แบม
M_2.2.4.3,2.,2.2,2.2.4 สำรวจความตระหนักและทัศนคติเกี่ยวกับการบริหารความเสี่ยง,สรุปผลการสำรวจความตระหนักและทัศนคติ,งานบริหารความเสี่ยง / แบม
M_2.2.4.4,2.,2.2,2.2.4 สำรวจความตระหนักและทัศนคติเกี่ยวกับการบริหารความเสี่ยง,ประเมินประสิทธิผลและกำหนดแนวทางการปรับปรุงการดำเนินงาน,งานบริหารความเสี่ยง / แบม
M_2.2.5.1,2.,2.2,2.2.5 ทบทวนการจัดทำการเชื่อมโยง KPI กับผลการดำเนินงานด้านการบริหารความเสี่ยงของแต่ละสายงาน,ทบทวนโครงสร้าง KPI สายงาน เชื่อมโยงผลการบริหารความเสี่ยงใน KPI ผู้บริหารสายงาน ร่วมกับ ฝทม.,งานบริหารความเสี่ยง / แบม
M_2.2.5.2,2.,2.2,2.2.5 ทบทวนการจัดทำการเชื่อมโยง KPI กับผลการดำเนินงานด้านการบริหารความเสี่ยงของแต่ละสายงาน,กำหนดแนวทางเชื่อมโยงผลการบริหารความเสี่ยงองค์กร/สายงาน/หน่วยงาน,งานบริหารความเสี่ยง / แบม
M_2.2.5.3,2.,2.2,2.2.5 ทบทวนการจัดทำการเชื่อมโยง KPI กับผลการดำเนินงานด้านการบริหารความเสี่ยงของแต่ละสายงาน,ถ่ายทอดลงสูระดับสายงาน/หน่วยงาน สอดคล้องกับการประเมินผลองค์กร,งานบริหารความเสี่ยง / แบม
M_2.2.5.4,2.,2.2,2.2.5 ทบทวนการจัดทำการเชื่อมโยง KPI กับผลการดำเนินงานด้านการบริหารความเสี่ยงของแต่ละสายงาน,ประเมินประสิทธิผลและกำหนดแนวทางการปรับปรุงการดำเนินงาน,งานบริหารความเสี่ยง / แบม
M_2.2.6.1,2.,2.2,2.2.6 ดำเนินการตามโครงการ MEA GRC Award เพื่อบูรณาการการบริหารความเสี่ยงกับผลตอบแทน/แรงจูงใจ,จัดจ้างที่ปรึกษา,เจ้นท์ / แบม
M_2.2.6.2,2.,2.2,2.2.6 ดำเนินการตามโครงการ MEA GRC Award เพื่อบูรณาการการบริหารความเสี่ยงกับผลตอบแทน/แรงจูงใจ,ชี้แจงการเข้าร่วมโครงการ,เจ้นท์ / แบม
M_2.2.6.3,2.,2.2,2.2.6 ดำเนินการตามโครงการ MEA GRC Award เพื่อบูรณาการการบริหารความเสี่ยงกับผลตอบแทน/แรงจูงใจ,ดำเนินการตามโครงการและให้คำปรึกษาแก่สายงาน,เจ้นท์ / แบม
M_2.2.6.4,2.,2.2,2.2.6 ดำเนินการตามโครงการ MEA GRC Award เพื่อบูรณาการการบริหารความเสี่ยงกับผลตอบแทน/แรงจูงใจ,ประเมินคะแนนและประกาศผล,เจ้นท์ / แบม
M_2.2.6.5,2.,2.2,2.2.6 ดำเนินการตามโครงการ MEA GRC Award เพื่อบูรณาการการบริหารความเสี่ยงกับผลตอบแทน/แรงจูงใจ,ประเมินประสิทธิผลและกำหนดแนวทางการปรับปรุงการดำเนินงาน,เจ้นท์ / แบม
M_2.2.6.6,2.,2.2,2.2.6 ดำเนินการตามโครงการ MEA GRC Award เพื่อบูรณาการการบริหารความเสี่ยงกับผลตอบแทน/แรงจูงใจ,นำเสนอผู้บริหารเพื่อทราบผลการประเมิน,เจ้นท์ / แบม
M_2.3.1.1,2.,2.3,2.3.1 ทบทวนหลักการกำหนด RA/RT และ RA Statement พร้อมสื่อสารให้แก่ผู้มีส่วนได้ส่วนเสีย,ทบทวนหลักการกำหนด RA/RT และ RA Statement,งานบริหารความเสี่ยง / เป็ด
M_2.3.1.2,2.,2.3,2.3.1 ทบทวนหลักการกำหนด RA/RT และ RA Statement พร้อมสื่อสารให้แก่ผู้มีส่วนได้ส่วนเสีย,พิจารณาเป้าหมายของ SO Goal KPI,งานบริหารความเสี่ยง / เป็ด
M_2.3.1.3,2.,2.3,2.3.1 ทบทวนหลักการกำหนด RA/RT และ RA Statement พร้อมสื่อสารให้แก่ผู้มีส่วนได้ส่วนเสีย,กำหนด RA/RT ให้สอดคล้องกับเป้าหมายขององค์กร และเป้าหมายของแผนแม่บท,งานบริหารความเสี่ยง / เป็ด
M_2.3.1.4,2.,2.3,2.3.1 ทบทวนหลักการกำหนด RA/RT และ RA Statement พร้อมสื่อสารให้แก่ผู้มีส่วนได้ส่วนเสีย,ชี้แจง RA/RT ให้แผนแม่บท และ สื่อสารให้บุคลากรภายในทราบ,งานบริหารความเสี่ยง / เป็ด
M_2.3.1.5,2.,2.3,2.3.1 ทบทวนหลักการกำหนด RA/RT และ RA Statement พร้อมสื่อสารให้แก่ผู้มีส่วนได้ส่วนเสีย,ประเมินประสิทธิผลและกำหนดแนวทางการปรับปรุงการดำเนินงาน,งานบริหารความเสี่ยง / เป็ด
M_2.3.2.1,2.,2.3,2.3.2 ระบุ Emerging Risk เป็นข้อมูลนำเข้าในการวิเคราะห์สภาพแวดล้อม,สรุปข้อมูลผลการดำเนินงานด้านการบริหารความเสี่ยงของปีที่ผ่านมา,งานบริหารความเสี่ยง / เป็ด
M_2.3.2.2,2.,2.3,2.3.2 ระบุ Emerging Risk เป็นข้อมูลนำเข้าในการวิเคราะห์สภาพแวดล้อม,วิเคราะห์ข้อมูล Emerging Risk / ESG Risk,งานบริหารความเสี่ยง / เป็ด
M_2.3.2.3,2.,2.3,2.3.2 ระบุ Emerging Risk เป็นข้อมูลนำเข้าในการวิเคราะห์สภาพแวดล้อม,นำส่งข้อมูลให้ ฝผก. เพื่อเป็นข้อมูลนำเข้าในการวิเคราะห์สภาพแวดล้อม,งานบริหารความเสี่ยง / เป็ด
